OpenROAD b16bda7e82721d10566ff7e2b68f1ff0be9f9e38 
Features included (+) or not (-): +Charts +GPU +GUI +Python
This program is licensed under the BSD-3 license. See the LICENSE file for details.
Components of this program may be licensed under more restrictive licenses which must be honored.
define_corners Typical
read_liberty -corner Typical /home/running_courses/EE671/EE671_4/.volare/sky130A/libs.ref/sky130_fd_sc_hd/lib/sky130_fd_sc_hd__tt_025C_1v80.lib
Using 1e-12 for capacitance...
Using 1e+03 for resistance...
Using 1e-09 for time...
Using 1e+00 for voltage...
Using 1e-03 for current...
Using 1e-09 for power...
Using 1e-06 for distance...
[INFO]: Reading ODB at '/openlane/designs/toplevel/runs/full_guide/tmp/16-toplevel.odb'…
Reading design constraints file at '/openlane/designs/toplevel/src/toplevel.sdc'…
[INFO]: Setting signal min routing layer to: met1 and clock min routing layer to met3. 
[INFO]: Setting signal max routing layer to: met5 and clock max routing layer to met5. 
-congestion_iterations 50 -verbose -congestion_report_file /openlane/designs/toplevel/runs/full_guide/tmp/routing/groute-congestion.rpt
[INFO GRT-0020] Min routing layer: met1
[INFO GRT-0021] Max routing layer: met5
[INFO GRT-0022] Global adjustment: 30%
[INFO GRT-0023] Grid origin: (0, 0)
[INFO GRT-0043] No OR_DEFAULT vias defined.
[INFO GRT-0088] Layer li1     Track-Pitch = 0.4600  line-2-Via Pitch: 0.3400
[INFO GRT-0088] Layer met1    Track-Pitch = 0.3400  line-2-Via Pitch: 0.3400
[INFO GRT-0088] Layer met2    Track-Pitch = 0.4600  line-2-Via Pitch: 0.3500
[INFO GRT-0088] Layer met3    Track-Pitch = 0.6800  line-2-Via Pitch: 0.6150
[INFO GRT-0088] Layer met4    Track-Pitch = 0.9200  line-2-Via Pitch: 1.0400
[INFO GRT-0088] Layer met5    Track-Pitch = 3.4000  line-2-Via Pitch: 3.1100
[INFO GRT-0019] Found 332 clock nets.
[INFO GRT-0001] Minimum degree: 2
[INFO GRT-0002] Maximum degree: 110
[INFO GRT-0003] Macros: 0
[INFO GRT-0043] No OR_DEFAULT vias defined.
[INFO GRT-0004] Blockages: 54232

[INFO GRT-0053] Routing resources analysis:
          Routing      Original      Derated      Resource
Layer     Direction    Resources     Resources    Reduction (%)
---------------------------------------------------------------
li1        Vertical            0             0          0.00%
met1       Horizontal     391265        188369          51.86%
met2       Vertical       292195        191427          34.49%
met3       Horizontal     195563        132498          32.25%
met4       Vertical       117046         57965          50.48%
met5       Horizontal      39057         16146          58.66%
---------------------------------------------------------------

[INFO GRT-0101] Running extra iterations to remove overflow.
[INFO GRT-0197] Via related to pin nodes: 190495
[INFO GRT-0198] Via related Steiner nodes: 5159
[INFO GRT-0199] Via filling finished.
[INFO GRT-0111] Final number of vias: 241542
[INFO GRT-0112] Final usage 3D: 899176

[INFO GRT-0096] Final congestion report:
Layer         Resource        Demand        Usage (%)    Max H / Max V / Total Overflow
---------------------------------------------------------------------------------------
li1                  0             0            0.00%             0 /  0 /  0
met1            188369         79764           42.34%             0 /  0 /  0
met2            191427         79986           41.78%             0 /  0 /  0
met3            132498          6995            5.28%             0 /  0 /  0
met4             57965          7805           13.47%             0 /  0 /  0
met5             16146             0            0.00%             0 /  0 /  0
---------------------------------------------------------------------------------------
Total           586405        174550           29.77%             0 /  0 /  0

[INFO GRT-0018] Total wirelength: 1799016 um
[INFO GRT-0014] Routed nets: 36021
[INFO GRT-0006] Repairing antennas, iteration 1.
[INFO GRT-0043] No OR_DEFAULT vias defined.
[INFO GRT-0012] Found 105 antenna violations.
[INFO GRT-0015] Inserted 135 diodes.
[INFO GRT-0009] rerouting 22254 nets.
[INFO GRT-0001] Minimum degree: 2
[INFO GRT-0002] Maximum degree: 110
[INFO GRT-0006] Repairing antennas, iteration 2.
[INFO GRT-0043] No OR_DEFAULT vias defined.
[INFO GRT-0012] Found 26 antenna violations.
[INFO GRT-0015] Inserted 56 diodes.
[INFO GRT-0054] Using detailed placer to place 11 diodes.
[INFO GRT-0009] rerouting 280 nets.
[INFO GRT-0001] Minimum degree: 2
[INFO GRT-0002] Maximum degree: 101
[INFO GRT-0006] Repairing antennas, iteration 3.
[INFO GRT-0043] No OR_DEFAULT vias defined.
[INFO GRT-0012] Found 3 antenna violations.
[INFO GRT-0015] Inserted 3 diodes.
[INFO GRT-0009] rerouting 17 nets.
[INFO GRT-0001] Minimum degree: 2
[INFO GRT-0002] Maximum degree: 15
[INFO GRT-0006] Repairing antennas, iteration 4.
[INFO GRT-0043] No OR_DEFAULT vias defined.
[INFO GRT-0012] Found 1 antenna violations.
[INFO GRT-0015] Inserted 1 diodes.
[INFO GRT-0009] rerouting 1 nets.
[INFO GRT-0001] Minimum degree: 15
[INFO GRT-0002] Maximum degree: 15
[INFO GRT-0006] Repairing antennas, iteration 5.
[INFO GRT-0043] No OR_DEFAULT vias defined.
[INFO GRT-0012] Found 0 antenna violations.
Placement Analysis
---------------------------------
total displacement          0.0 u
average displacement        0.0 u
max displacement            0.0 u
original HPWL         1050826.0 u
legalized HPWL        1050829.7 u
delta HPWL                    0 %

[INFO DPL-0020] Mirrored 12442 instances
[INFO DPL-0021] HPWL before          1050829.7 u
[INFO DPL-0022] HPWL after           1027760.2 u
[INFO DPL-0023] HPWL delta               -2.2 %
[INFO]: Setting signal min routing layer to: met1 and clock min routing layer to met3. 
[INFO]: Setting signal max routing layer to: met5 and clock max routing layer to met5. 
-congestion_iterations 50 -verbose -congestion_report_file /openlane/designs/toplevel/runs/full_guide/tmp/routing/groute-congestion.rpt
[INFO GRT-0020] Min routing layer: met1
[INFO GRT-0021] Max routing layer: met5
[INFO GRT-0022] Global adjustment: 30%
[INFO GRT-0023] Grid origin: (0, 0)
[INFO GRT-0043] No OR_DEFAULT vias defined.
[INFO GRT-0088] Layer li1     Track-Pitch = 0.4600  line-2-Via Pitch: 0.3400
[INFO GRT-0088] Layer met1    Track-Pitch = 0.3400  line-2-Via Pitch: 0.3400
[INFO GRT-0088] Layer met2    Track-Pitch = 0.4600  line-2-Via Pitch: 0.3500
[INFO GRT-0088] Layer met3    Track-Pitch = 0.6800  line-2-Via Pitch: 0.6150
[INFO GRT-0088] Layer met4    Track-Pitch = 0.9200  line-2-Via Pitch: 1.0400
[INFO GRT-0088] Layer met5    Track-Pitch = 3.4000  line-2-Via Pitch: 3.1100
[INFO GRT-0019] Found 332 clock nets.
[INFO GRT-0001] Minimum degree: 2
[INFO GRT-0002] Maximum degree: 110
[INFO GRT-0003] Macros: 0
[INFO GRT-0043] No OR_DEFAULT vias defined.
[INFO GRT-0004] Blockages: 54232

[INFO GRT-0053] Routing resources analysis:
          Routing      Original      Derated      Resource
Layer     Direction    Resources     Resources    Reduction (%)
---------------------------------------------------------------
li1        Vertical            0             0          0.00%
met1       Horizontal     391265        188371          51.86%
met2       Vertical       292195        191427          34.49%
met3       Horizontal     195563        132498          32.25%
met4       Vertical       117046         57965          50.48%
met5       Horizontal      39057         16146          58.66%
---------------------------------------------------------------

[INFO GRT-0101] Running extra iterations to remove overflow.
[INFO GRT-0197] Via related to pin nodes: 190704
[INFO GRT-0198] Via related Steiner nodes: 5172
[INFO GRT-0199] Via filling finished.
[INFO GRT-0111] Final number of vias: 241823
[INFO GRT-0112] Final usage 3D: 900083

[INFO GRT-0096] Final congestion report:
Layer         Resource        Demand        Usage (%)    Max H / Max V / Total Overflow
---------------------------------------------------------------------------------------
li1                  0             0            0.00%             0 /  0 /  0
met1            188371         79602           42.26%             0 /  0 /  0
met2            191427         80229           41.91%             0 /  0 /  0
met3            132498          7158            5.40%             0 /  0 /  0
met4             57965          7625           13.15%             0 /  0 /  0
met5             16146             0            0.00%             0 /  0 /  0
---------------------------------------------------------------------------------------
Total           586407        174614           29.78%             0 /  0 /  0

[INFO GRT-0018] Total wirelength: 1800624 um
[INFO GRT-0014] Routed nets: 36021
Setting global connections for newly added cells…
Writing OpenROAD database to '/openlane/designs/toplevel/runs/full_guide/tmp/routing/18-global.odb'…
Writing layout to '/openlane/designs/toplevel/runs/full_guide/tmp/routing/18-global.def'…
Writing routing guides to '/openlane/designs/toplevel/runs/full_guide/tmp/routing/18-global.guide'…
